{
  "goal_id": "WFG-SECURITY-0154",
  "composition": {
    "composition_type": "single_path",
    "num_semantically_distinct_paths": 1,
    "distinctness_rule": "Reach the target state through the full reset request, reset completion, two-factor, rotation, and audit chain rather than through a shorter subset route."
  },
  "module_nodes": [
    {
      "module_id": "MODULE_2FA_SETUP",
      "role": "required",
      "produces": [
        "two_factor_enabled"
      ]
    },
    {
      "module_id": "MODULE_PASSWORD_RESET_COMPLETION",
      "role": "required",
      "produces": [
        "password_reset_completed"
      ]
    },
    {
      "module_id": "MODULE_PASSWORD_RESET_REQUEST",
      "role": "required",
      "produces": [
        "password_reset_code_requested"
      ]
    },
    {
      "module_id": "MODULE_SECURITY_AUDIT",
      "role": "required",
      "produces": [
        "security_audit_completed"
      ]
    },
    {
      "module_id": "MODULE_SECURITY_ROTATION",
      "role": "required",
      "produces": [
        "secret_rotated",
        "security_hardening_completed"
      ]
    }
  ],
  "dependency_edges": [
    {
      "from": "MODULE_2FA_SETUP",
      "to": "MODULE_SECURITY_ROTATION",
      "kind": "hard"
    },
    {
      "from": "MODULE_PASSWORD_RESET_COMPLETION",
      "to": "MODULE_2FA_SETUP",
      "kind": "hard"
    },
    {
      "from": "MODULE_PASSWORD_RESET_REQUEST",
      "to": "MODULE_PASSWORD_RESET_COMPLETION",
      "kind": "hard"
    },
    {
      "from": "MODULE_SECURITY_ROTATION",
      "to": "MODULE_SECURITY_AUDIT",
      "kind": "hard"
    }
  ],
  "success_paths": [
    {
      "path_id": "path_reset_completion_twofa_rotation_audit",
      "required_modules": [
        "MODULE_PASSWORD_RESET_REQUEST",
        "MODULE_PASSWORD_RESET_COMPLETION",
        "MODULE_2FA_SETUP",
        "MODULE_SECURITY_ROTATION",
        "MODULE_SECURITY_AUDIT"
      ],
      "optional_modules": [],
      "reference_invocation_ids": [
        "WFG-SECURITY-0154-M1",
        "WFG-SECURITY-0154-M2",
        "WFG-SECURITY-0154-M3",
        "WFG-SECURITY-0154-M4",
        "WFG-SECURITY-0154-M5"
      ],
      "terminal_predicates": [
        "password_reset_completed",
        "two_factor_enabled",
        "security_hardening_completed",
        "security_audit_completed"
      ]
    }
  ],
  "reference_invocations": [
    {
      "invocation_id": "WFG-SECURITY-0154-M1",
      "module_id": "MODULE_PASSWORD_RESET_REQUEST",
      "binding_id": "BIND_M5_RESET_PASSWORD",
      "binding_task_id": "M5-2025-RESETCODE",
      "parameter_values": {
        "username": "demo_user"
      },
      "description": "Request a password reset code for account recovery.",
      "expected_observables": [
        "url().includes('/security.local/reset-password.html')",
        "exists(\"#new-password\")",
        "NOT[url().includes('about:blank')]",
        "NOT[url().includes('chrome-error://')]"
      ],
      "instantiated_effects": {
        "adds": [
          "password_reset_code_requested"
        ],
        "removes": []
      }
    },
    {
      "invocation_id": "WFG-SECURITY-0154-M2",
      "module_id": "MODULE_PASSWORD_RESET_COMPLETION",
      "binding_id": "BIND_M6_ACCOUNT_RECOVERY",
      "binding_task_id": "M6-2025-PWRECOVERY",
      "parameter_values": {
        "username": "demo_user",
        "code": "1234"
      },
      "description": "Complete account recovery by resetting the password with verification code.",
      "expected_observables": [
        "url().includes('/security.local/login.html?reset=success')",
        "exists(\"#reset-success\")",
        "NOT[url().includes('about:blank')]",
        "NOT[url().includes('chrome-error://')]"
      ],
      "instantiated_effects": {
        "adds": [
          "password_reset_completed"
        ],
        "removes": []
      }
    },
    {
      "invocation_id": "WFG-SECURITY-0154-M3",
      "module_id": "MODULE_2FA_SETUP",
      "binding_id": "BIND_L8_2FA_SETUP",
      "binding_task_id": "L8-2025-2FASETUP",
      "parameter_values": {},
      "description": "Set up 2FA with a new primary device.",
      "expected_observables": [
        "exists(\"div[id='2fa-status']\")",
        "NOT[url().includes('about:blank')]",
        "NOT[url().includes('chrome-error://')]"
      ],
      "instantiated_effects": {
        "adds": [
          "two_factor_enabled"
        ],
        "removes": []
      }
    },
    {
      "invocation_id": "WFG-SECURITY-0154-M4",
      "module_id": "MODULE_SECURITY_ROTATION",
      "binding_id": "BIND_L3_SECURITY_ROTATION",
      "binding_task_id": "L3-2025-SEC",
      "parameter_values": {
        "providers": [
          "mail",
          "cloud",
          "dev"
        ],
        "rotate": "mfa+api"
      },
      "description": "Check the security dashboard for compromised accounts and rotate keys for all affected providers.",
      "expected_observables": [],
      "instantiated_effects": {
        "adds": [
          "secret_rotated",
          "security_hardening_completed"
        ],
        "removes": []
      }
    },
    {
      "invocation_id": "WFG-SECURITY-0154-M5",
      "module_id": "MODULE_SECURITY_AUDIT",
      "binding_id": "BIND_L7_SECURITY_AUDIT",
      "binding_task_id": "L7-2025-CLOUDROTATE",
      "parameter_values": {},
      "description": "Rotate credentials for Cloud Storage and Dev Platform using API-only rotation.",
      "expected_observables": [
        "json('env','security.last_rotation.providers.0') == 'cloud'",
        "json('env','security.last_rotation.providers.1') == 'dev'"
      ],
      "instantiated_effects": {
        "adds": [
          "security_audit_completed"
        ],
        "removes": []
      }
    }
  ],
  "evaluation": {
    "final_success": [
      "password_reset_completed",
      "two_factor_enabled",
      "security_hardening_completed",
      "security_audit_completed"
    ],
    "checkpoint_predicates": [
      "password_reset_code_requested",
      "password_reset_completed",
      "secret_rotated",
      "security_audit_completed",
      "security_hardening_completed",
      "two_factor_enabled"
    ],
    "unnecessary_module_penalty": 0.2,
    "invalid_transition_penalty": 1.25,
    "recovery_bonus": 0.0
  }
}
