{
  "goal_id": "WFG-SECURITY-0178",
  "composition": {
    "composition_type": "single_path",
    "num_semantically_distinct_paths": 1,
    "distinctness_rule": "Reach the target through the full export, privacy-review, credential-review, audit, and deletion chain rather than through a shorter exit subset."
  },
  "module_nodes": [
    {
      "module_id": "MODULE_DATA_DELETION",
      "role": "required",
      "produces": [
        "deletion_request_submitted"
      ]
    },
    {
      "module_id": "MODULE_DOWNLOAD_DATA",
      "role": "required",
      "produces": [
        "account_data_exported",
        "account_exit_prepared"
      ]
    },
    {
      "module_id": "MODULE_PASSWORD_MANAGER",
      "role": "required",
      "produces": [
        "access_surface_reviewed",
        "credential_vault_updated",
        "security_hardening_completed"
      ]
    },
    {
      "module_id": "MODULE_PRIVACY_SETTINGS",
      "role": "required",
      "produces": [
        "access_surface_reviewed",
        "account_exit_prepared",
        "privacy_settings_updated"
      ]
    },
    {
      "module_id": "MODULE_SECURITY_AUDIT",
      "role": "required",
      "produces": [
        "security_audit_completed"
      ]
    }
  ],
  "dependency_edges": [
    {
      "from": "MODULE_DOWNLOAD_DATA",
      "to": "MODULE_PRIVACY_SETTINGS",
      "kind": "hard"
    },
    {
      "from": "MODULE_PASSWORD_MANAGER",
      "to": "MODULE_SECURITY_AUDIT",
      "kind": "hard"
    },
    {
      "from": "MODULE_PRIVACY_SETTINGS",
      "to": "MODULE_PASSWORD_MANAGER",
      "kind": "hard"
    },
    {
      "from": "MODULE_SECURITY_AUDIT",
      "to": "MODULE_DATA_DELETION",
      "kind": "hard"
    }
  ],
  "success_paths": [
    {
      "path_id": "path_export_privacy_vault_audit_delete",
      "required_modules": [
        "MODULE_DOWNLOAD_DATA",
        "MODULE_PRIVACY_SETTINGS",
        "MODULE_PASSWORD_MANAGER",
        "MODULE_SECURITY_AUDIT",
        "MODULE_DATA_DELETION"
      ],
      "optional_modules": [],
      "reference_invocation_ids": [
        "WFG-SECURITY-0178-M1",
        "WFG-SECURITY-0178-M2",
        "WFG-SECURITY-0178-M3",
        "WFG-SECURITY-0178-M4",
        "WFG-SECURITY-0178-M5"
      ],
      "terminal_predicates": [
        "account_data_exported",
        "account_exit_prepared",
        "access_surface_reviewed",
        "privacy_settings_updated",
        "credential_vault_updated",
        "security_audit_completed",
        "deletion_request_submitted"
      ]
    }
  ],
  "reference_invocations": [
    {
      "invocation_id": "WFG-SECURITY-0178-M1",
      "module_id": "MODULE_DOWNLOAD_DATA",
      "binding_id": "BIND_L6_DOWNLOAD_DATA",
      "binding_task_id": "L6-2025-DATAEXPORT",
      "parameter_values": {
        "request_type": "export",
        "platform": "NebulaCloud"
      },
      "description": "Submit a personal data export request.",
      "expected_observables": [
        "exists(\"#requests-list .card\")",
        "NOT[url().includes('about:blank')]",
        "NOT[url().includes('chrome-error://')]"
      ],
      "instantiated_effects": {
        "adds": [
          "account_data_exported",
          "account_exit_prepared"
        ],
        "removes": []
      }
    },
    {
      "invocation_id": "WFG-SECURITY-0178-M2",
      "module_id": "MODULE_PRIVACY_SETTINGS",
      "binding_id": "BIND_L5_PRIVACY_SETTINGS",
      "binding_task_id": "L5-2025-CREDENTIALADD",
      "parameter_values": {
        "site": "SocialHub",
        "username": "privacy_user"
      },
      "description": "Add a new privacy credential entry in password manager.",
      "expected_observables": [
        "exists(\"#password-list .card\")",
        "NOT[url().includes('about:blank')]",
        "NOT[url().includes('chrome-error://')]"
      ],
      "instantiated_effects": {
        "adds": [
          "access_surface_reviewed",
          "account_exit_prepared",
          "privacy_settings_updated"
        ],
        "removes": []
      }
    },
    {
      "invocation_id": "WFG-SECURITY-0178-M3",
      "module_id": "MODULE_PASSWORD_MANAGER",
      "binding_id": "BIND_L1_PASSWORD_MANAGER",
      "binding_task_id": "L1-2025-PASSMGR",
      "parameter_values": {
        "site": "Overleaf",
        "username": "paper.drafts@example.com",
        "password": "Overleaf$Draft6"
      },
      "description": "Add a password manager entry for Overleaf using username paper.drafts@example.com.",
      "expected_observables": [
        "exists(\"#password-list .card:has-text('Overleaf')\")"
      ],
      "instantiated_effects": {
        "adds": [
          "access_surface_reviewed",
          "credential_vault_updated",
          "security_hardening_completed"
        ],
        "removes": []
      }
    },
    {
      "invocation_id": "WFG-SECURITY-0178-M4",
      "module_id": "MODULE_SECURITY_AUDIT",
      "binding_id": "BIND_L7_SECURITY_AUDIT",
      "binding_task_id": "L7-2025-CLOUDROTATE",
      "parameter_values": {},
      "description": "Rotate credentials for Cloud Storage and Dev Platform using API-only rotation.",
      "expected_observables": [
        "json('env','security.last_rotation.providers.0') == 'cloud'",
        "json('env','security.last_rotation.providers.1') == 'dev'"
      ],
      "instantiated_effects": {
        "adds": [
          "security_audit_completed"
        ],
        "removes": []
      }
    },
    {
      "invocation_id": "WFG-SECURITY-0178-M5",
      "module_id": "MODULE_DATA_DELETION",
      "binding_id": "BIND_L2_DATA_DELETION",
      "binding_task_id": "L2-2025-DSR",
      "parameter_values": {
        "platform": "Facebook",
        "request_type": "export",
        "data_scope": "posts, photos, messages"
      },
      "description": "Submit an export request to Facebook covering posts, photos, and messages.",
      "expected_observables": [
        "exists(\"#requests-list .card:has-text('Facebook')\")"
      ],
      "instantiated_effects": {
        "adds": [
          "deletion_request_submitted"
        ],
        "removes": []
      }
    }
  ],
  "evaluation": {
    "final_success": [
      "account_data_exported",
      "account_exit_prepared",
      "access_surface_reviewed",
      "privacy_settings_updated",
      "credential_vault_updated",
      "security_audit_completed",
      "deletion_request_submitted"
    ],
    "checkpoint_predicates": [
      "access_surface_reviewed",
      "account_data_exported",
      "account_exit_prepared",
      "credential_vault_updated",
      "deletion_request_submitted",
      "privacy_settings_updated",
      "security_audit_completed",
      "security_hardening_completed"
    ],
    "unnecessary_module_penalty": 0.2,
    "invalid_transition_penalty": 1.25,
    "recovery_bonus": 0.0
  }
}
